id_discussion,title,link,score,answer_count,view_count,creation_date,tags,Category
71056057,error: cannot shadow already defined class `Error` after adding console_error_panic_hook::set_once();,https://stackoverflow.com/questions/71056057/error-cannot-shadow-already-defined-class-error-after-adding-console-error-pa,1,1,175,2022/2/10 4:09,"rust, wasm-bindgen, wasm-pack",Corrective
74152099,how to fix &quot;InvalidSeeds&quot; error in AssociatedTokenAccountProgram?,https://stackoverflow.com/questions/74152099/how-to-fix-invalidseeds-error-in-associatedtokenaccountprogram,0,1,175,2022/10/21 18:12,solana,Corrective
69747128,Rust wasm module build error (x11-clipboard dependency),https://stackoverflow.com/questions/69747128/rust-wasm-module-build-error-x11-clipboard-dependency,0,0,174,2021/10/28 9:06,"rust, webassembly, rust-cargo, rust-wasm, wasm-pack",Corrective
70436328,Getting unexpected lifetime issue when passing newly constructed array to function,https://stackoverflow.com/questions/70436328/getting-unexpected-lifetime-issue-when-passing-newly-constructed-array-to-functi,1,1,170,2021/12/21 21:33,"rust, solana",Corrective
70227462,TypeError: this is undefined in rect js while passing BigNumber in solana RPC Request,https://stackoverflow.com/questions/70227462/typeerror-this-is-undefined-in-rect-js-while-passing-bignumber-in-solana-rpc-re,0,1,167,2021/12/5 0:25,"reactjs, blockchain, solana, decentralized-applications, solana-cli",Corrective
71698654,"Terra - terrain deploy counter - Error: Command failed: cp artifacts/counter{-aarch64,}.wasm",https://stackoverflow.com/questions/71698654/terra-terrain-deploy-counter-error-command-failed-cp-artifacts-counter-aa,1,3,167,2022/4/1 4:14,"webassembly, terrain, terra, rust-wasm",Corrective
70710400,Issues adding NEAR tokens in assemblyscript smart contract using u128.add() function,https://stackoverflow.com/questions/70710400/issues-adding-near-tokens-in-assemblyscript-smart-contract-using-u128-add-func,1,2,166,2022/1/14 20:12,"nearprotocol, assemblyscript, near",Corrective
76741201,Error running a Bevy game in browser: &quot;WebAssembly.instantiate(): Import #0 module=&quot;wbindgen_placeholder&quot; error: module is not an object or function&quot;,https://stackoverflow.com/questions/76741201/error-running-a-bevy-game-in-browser-webassembly-instantiate-import-0-modu,0,1,165,2023/7/22 4:58,"rust, webassembly, webgl2, wasm-bindgen, bevy",Corrective
72827202,How to use the createRevokeCollectionAuthorityInstruction to an NFT: &quot;Derived key invalid&quot; error,https://stackoverflow.com/questions/72827202/how-to-use-the-createrevokecollectionauthorityinstruction-to-an-nft-derived-ke,0,1,162,2022/7/1 17:29,"solana, metaplex",Corrective
72570426,When I run this command to deploy the solana contract this error is reported,https://stackoverflow.com/questions/72570426/when-i-run-this-command-to-deploy-the-solana-contract-this-error-is-reported,0,0,161,2022/6/10 15:16,"solana, solana-program-library",Corrective
69734254,Error: the trait bound `types::DepartmentDetails: scale_info::TypeInfo` is not satisfied,https://stackoverflow.com/questions/69734254/error-the-trait-bound-typesdepartmentdetails-scale-infotypeinfo-is-not-s,0,1,160,2021/10/27 15:12,"substrate, polkadot",Corrective
70743408,substrate-developer-hub/substrate-front-end-template run yarn error,https://stackoverflow.com/questions/70743408/substrate-developer-hub-substrate-front-end-template-run-yarn-error,1,1,159,2022/1/17 23:00,"substrate, polkadot",Corrective
74041773,Near: Querying [object Object] failed: wasm execution failed with error: FunctionCallError,https://stackoverflow.com/questions/74041773/near-querying-object-object-failed-wasm-execution-failed-with-error-functio,0,0,158,2022/10/12 20:24,"rust, integration-testing, nearprotocol, ava",Corrective
72093138,"Contract call returns error &quot;Found input with 28 bits, expected 8&quot;. Polkadot.js and ink contracts",https://stackoverflow.com/questions/72093138/contract-call-returns-error-found-input-with-28-bits-expected-8-polkadot-js,1,0,158,2022/5/3 6:45,"smartcontracts, polkadot, polkadot-js, rust-ink",Corrective
66072515,Could not convert parameter `tx` between node and runtime: Error decoding field CheckMortality.0,https://stackoverflow.com/questions/66072515/could-not-convert-parameter-tx-between-node-and-runtime-error-decoding-field,1,1,156,2021/2/6 8:47,"blockchain, substrate, polkadot, parity-io, polkadot-js",Corrective
75103167,Transaction simulation failed: Error processing Instruction 0: custom program error: 0xc at Connection.sendEncodedTransaction,https://stackoverflow.com/questions/75103167/transaction-simulation-failed-error-processing-instruction-0-custom-program-er,0,1,155,2023/1/13 6:57,"rust, anchor, solana, solana-web3js",Corrective
75361401,Why does Cargo incorrectly compile Rust WASM global variables?,https://stackoverflow.com/questions/75361401/why-does-cargo-incorrectly-compile-rust-wasm-global-variables,2,0,155,2023/2/6 20:36,"rust, webassembly, rust-cargo, rust-wasm",Corrective
74744241,Error handling when testing Solana event emitting,https://stackoverflow.com/questions/74744241/error-handling-when-testing-solana-event-emitting,0,1,148,2022/12/9 22:09,"javascript, solana, solana-web3js, anchor-solana",Corrective
74051628,How to get unique smart contract errors in a frontend app using polkadot.js,https://stackoverflow.com/questions/74051628/how-to-get-unique-smart-contract-errors-in-a-frontend-app-using-polkadot-js,0,2,148,2022/10/13 14:58,"substrate, polkadot-js",Corrective
72808663,can&#39;t upload candy machine collection because of time out error,https://stackoverflow.com/questions/72808663/cant-upload-candy-machine-collection-because-of-time-out-error,0,2,146,2022/6/30 6:53,"typescript, rust, solana, metaplex, candy-machine",Corrective
73880436,Solana ECONNREFUSED error on localhost for the simple airdrop transaction,https://stackoverflow.com/questions/73880436/solana-econnrefused-error-on-localhost-for-the-simple-airdrop-transaction,0,1,145,2022/9/28 19:11,"solana, solana-web3js",Corrective
73566083,Solana Phantom Wallet - Error: airdrop request failed. This can happen when the rate limit is reached,https://stackoverflow.com/questions/73566083/solana-phantom-wallet-error-airdrop-request-failed-this-can-happen-when-the,0,1,143,2022/9/1 16:06,"smartcontracts, solana, solana-web3js, anchor-solana, solana-cli",Corrective
72520297,Getting an Error `custom program error: 0x26` on Minting an NFT?,https://stackoverflow.com/questions/72520297/getting-an-error-custom-program-error-0x26-on-minting-an-nft,-1,1,142,2022/6/6 23:53,"solana, metaplex",Corrective
70992739,yarn asb parsing error in compiling Assemblyscript smart contract,https://stackoverflow.com/questions/70992739/yarn-asb-parsing-error-in-compiling-assemblyscript-smart-contract,0,1,142,2022/2/5 4:54,"typescript, parsing, yarnpkg, nearprotocol, assemblyscript",Corrective
72201709,Getting error while using #[js_export] from crate stdweb,https://stackoverflow.com/questions/72201709/getting-error-while-using-js-export-from-crate-stdweb,0,0,139,2022/5/11 21:13,"rust, rust-wasm",Corrective
68181488,Error when cargo build node-template substrate,https://stackoverflow.com/questions/68181488/error-when-cargo-build-node-template-substrate,0,1,139,2021/6/29 23:16,"substrate, polkadot",Corrective
73304314,getting a &quot;this program may not be used for excuting instructions&quot; error when making a simple spl transfer,https://stackoverflow.com/questions/73304314/getting-a-this-program-may-not-be-used-for-excuting-instructions-error-when-ma,-1,1,135,2022/8/10 18:02,"python, solana, solana-transaction-instruction, solana-py",Corrective
74018774,INDEXER Lake Framework - outcome.status.failure not showing execution error,https://stackoverflow.com/questions/74018774/indexer-lake-framework-outcome-status-failure-not-showing-execution-error,0,2,134,2022/10/11 1:39,"nearprotocol, indexer",Corrective
75380991,Trying to load a library built with wasm pack in nodejs with ESM leads to an error,https://stackoverflow.com/questions/75380991/trying-to-load-a-library-built-with-wasm-pack-in-nodejs-with-esm-leads-to-an-err,0,1,134,2023/2/8 10:56,"node.js, es6-modules, wasm-pack",Corrective
73243690,Any solutions on why I get a compile error with import * as anchor from &quot;@project-serum/anchor&quot;;,https://stackoverflow.com/questions/73243690/any-solutions-on-why-i-get-a-compile-error-with-import-as-anchor-from-projec,0,1,134,2022/8/5 9:15,"rust, anchor, solana",Corrective
75008106,solana spl-token transfer fee &quot;Error: Program(IncorrectProgramId)&quot;,https://stackoverflow.com/questions/75008106/solana-spl-token-transfer-fee-error-programincorrectprogramid,-1,1,132,2023/1/5 0:02,"cryptography, blockchain, solana, fee",Corrective
72833435,[Stack]: RuntimeError: memory access out of bounds error while testing a function in a NEAR protocol smart contract assemblyscript,https://stackoverflow.com/questions/72833435/stack-runtimeerror-memory-access-out-of-bounds-error-while-testing-a-functio,0,0,127,2022/7/2 2:40,"nearprotocol, near, assemblyscript",Corrective
68288269,I am getting error when trying out Substrate&#39;s &quot;Create a Pallet&quot; Tutorial,https://stackoverflow.com/questions/68288269/i-am-getting-error-when-trying-out-substrates-create-a-pallet-tutorial,0,1,124,2021/7/7 22:48,"blockchain, substrate, polkadot",Corrective
67900397,Solana stake pool installation issue,https://stackoverflow.com/questions/67900397/solana-stake-pool-installation-issue,0,1,122,2021/6/9 16:30,"rust, blockchain, solana",Corrective
69263074,Error: Service(Telemetry(IoError(Custom {...... error in substrate,https://stackoverflow.com/questions/69263074/error-servicetelemetryioerrorcustom-error-in-substrate,0,0,121,2021/9/21 11:35,"blockchain, substrate, polkadot",Corrective
75732494,Issue playing output mp4 transcoded with ffmpeg wasm on mobile,https://stackoverflow.com/questions/75732494/issue-playing-output-mp4-transcoded-with-ffmpeg-wasm-on-mobile,1,1,121,2023/3/14 19:24,"javascript, ffmpeg, ffmpeg-wasm",Corrective
75924628,Attempted import error: &#39;AnchorProvider&#39; is not exported from &#39;@project-serum/anchor&#39;,https://stackoverflow.com/questions/75924628/attempted-import-error-anchorprovider-is-not-exported-from-project-serum-an,1,1,121,2023/4/4 8:24,"javascript, reactjs, runtime-error, jsx, anchor-solana",Corrective
75653979,How can I resolve not found cargo wasm error?,https://stackoverflow.com/questions/75653979/how-can-i-resolve-not-found-cargo-wasm-error,0,1,120,2023/3/7 1:28,"rust-cargo, wasm-pack",Corrective
75666476,running substrate benchmaks errors at setjmp file not found,https://stackoverflow.com/questions/75666476/running-substrate-benchmaks-errors-at-setjmp-file-not-found,2,0,120,2023/3/8 3:38,"substrate, polkadot",Corrective
70865711,polkadot canvas testnet contract deploy error &quot;contracts.contractTrapped&quot;,https://stackoverflow.com/questions/70865711/polkadot-canvas-testnet-contract-deploy-error-contracts-contracttrapped,0,2,120,2022/1/26 23:11,"substrate, polkadot, rust-ink",Corrective
76426991,read-fonts Rust wasm: Uncaught (in promise) RuntimeError: unreachable,https://stackoverflow.com/questions/76426991/read-fonts-rust-wasm-uncaught-in-promise-runtimeerror-unreachable,0,0,116,2023/6/8 4:42,"javascript, rust, fonts, webassembly, wasm-bindgen",Corrective
76231415,Non-base58 character error in create Fungible token in Solana,https://stackoverflow.com/questions/76231415/non-base58-character-error-in-create-fungible-token-in-solana,1,1,115,2023/5/12 4:33,"node.js, token, solana, solana-web3js, metaplex",Corrective
72855927,snapshot candy machine mint accounts in correct order of mint,https://stackoverflow.com/questions/72855927/snapshot-candy-machine-mint-accounts-in-correct-order-of-mint,0,1,115,2022/7/4 19:24,"solana, solana-web3js, metaboss",Corrective
74120365,Unable to transfer token to another account due toTypeError: Cannot read property &#39;toString&#39; of undefined,https://stackoverflow.com/questions/74120365/unable-to-transfer-token-to-another-account-due-totypeerror-cannot-read-propert,0,0,113,2022/10/19 13:38,"rust, solana, solana-web3js, anchor-solana, solana-program-library",Corrective
73042075,"how delete these conflict errors / rust/ E0277, E0432, E0599",https://stackoverflow.com/questions/73042075/how-delete-these-conflict-errors-rust-e0277-e0432-e0599,-3,1,112,2022/7/20 2:44,"rust, smartcontracts, solana, solana-web3js",Corrective
69909549,Implementing bridge network of substrate and getting error: duplicate lang item in crate `sp_io` required by bp_runtime,https://stackoverflow.com/questions/69909549/implementing-bridge-network-of-substrate-and-getting-error-duplicate-lang-item,0,1,111,2021/11/10 15:54,"blockchain, substrate, polkadot",Corrective
75173136,Deploying to fuji network with hardhat creates HttpProviderError,https://stackoverflow.com/questions/75173136/deploying-to-fuji-network-with-hardhat-creates-httpprovidererror,0,1,110,2023/1/19 21:39,"blockchain, smartcontracts, hardhat, avalanche",Corrective
71981378,Serum Error What is &quot;Unable to simulate swap&quot;?,https://stackoverflow.com/questions/71981378/serum-error-what-is-unable-to-simulate-swap,0,1,110,2022/4/24 0:04,"javascript, solana, anchor-solana, serum-project",Corrective
71104224,"ServerTransactionError: {&quot;index&quot;:0,&quot;kind&quot;:{&quot;ExecutionError&quot;:&quot;Smart contract panicked: Cannot parse JSON",https://stackoverflow.com/questions/71104224/servertransactionerror-index0-kindexecutionerrorsmart-contract-pani,0,0,110,2022/2/14 3:39,nearprotocol,Corrective
72249544,Why is there an error in this contract call?,https://stackoverflow.com/questions/72249544/why-is-there-an-error-in-this-contract-call,-1,1,108,2022/5/15 23:12,"nearprotocol, near-api-js",Corrective
72917751,Error with modules gumdrop-cli.ts metaplex,https://stackoverflow.com/questions/72917751/error-with-modules-gumdrop-cli-ts-metaplex,-2,1,101,2022/7/9 7:02,"blockchain, solana, nft, metaplex, cryptocurrency-airdrop",Corrective
76445810,TokenAccountNotFoundError encountered while trying to create token account,https://stackoverflow.com/questions/76445810/tokenaccountnotfounderror-encountered-while-trying-to-create-token-account,0,1,100,2023/6/10 18:28,"reactjs, solana-web3js",Corrective
76490441,Error: failed to send transaction: Transaction simulation failed: Error processing Instruction 0: Program failed to complete,https://stackoverflow.com/questions/76490441/error-failed-to-send-transaction-transaction-simulation-failed-error-processi,0,0,99,2023/6/16 20:58,"blockchain, solana, anchor-solana",Corrective
58642732,Error on returning environmental account id&#39;s,https://stackoverflow.com/questions/58642732/error-on-returning-environmental-account-ids,1,1,98,2019/10/31 19:49,nearprotocol,Corrective
75349748,Unhandled RunTime Error - MetaplexError: Account Not Found,https://stackoverflow.com/questions/75349748/unhandled-runtime-error-metaplexerror-account-not-found,0,0,95,2023/2/5 10:25,"javascript, solana, nft, metaplex",Corrective
76646083,Compile time error of cosmos-sdk/proto/bank/v1beta1/query.proto file,https://stackoverflow.com/questions/76646083/compile-time-error-of-cosmos-sdk-proto-bank-v1beta1-query-proto-file,2,1,94,2023/7/9 13:56,"go, blockchain, protoc, protobuf-go, cosmos-sdk",Corrective
72923295,Solana Metaplex Creator Split issue,https://stackoverflow.com/questions/72923295/solana-metaplex-creator-split-issue,-1,1,93,2022/7/10 1:09,"typescript, solana, metaplex",Corrective
75262206,Solana auctionHouse sell instruction showing error Types of property &#39;asset&#39; are incompatible,https://stackoverflow.com/questions/75262206/solana-auctionhouse-sell-instruction-showing-error-types-of-property-asset-are,0,0,90,2023/1/28 2:48,"nft, solana-web3js, metaplex, solana-program-library",Corrective
75328463,Metaplex Candy Machine UI - Mint Failed Error,https://stackoverflow.com/questions/75328463/metaplex-candy-machine-ui-mint-failed-error,0,0,89,2023/2/3 4:11,"solana, nft, metaplex, solana-cli, candy-machine",Corrective
73376298,1002: Verification Error: Execution: Could not convert parameter `tx` between node and runtime: No such variant in enum MultiAddress,https://stackoverflow.com/questions/73376298/1002-verification-error-execution-could-not-convert-parameter-tx-between-no,0,1,89,2022/8/16 23:11,"types, substrate, polkadot",Corrective
72570883,Metaplex uploading error. &quot;path&quot; argument must be string,https://stackoverflow.com/questions/72570883/metaplex-uploading-error-path-argument-must-be-string,0,1,85,2022/6/10 15:57,"solana, metaplex",Corrective
76317091,Transaction simulation failed: Error processing Instruction 0: custom program error: 0x5b,https://stackoverflow.com/questions/76317091/transaction-simulation-failed-error-processing-instruction-0-custom-program-er,0,0,85,2023/5/24 0:56,"solana, solana-web3js, metaplex, anchor-solana",Corrective
74077189,"&quot;contract&quot; can be obtained as a result of &quot;signAndSend&quot;, but the compilation error is not resolved",https://stackoverflow.com/questions/74077189/contract-can-be-obtained-as-a-result-of-signandsend-but-the-compilation-err,1,0,84,2022/10/15 14:23,"next.js, substrate, polkadot-js",Corrective
76507004,"When I tried to mint NFTs using cmv3 (from metaplex) in Solana using the ui and sugar-cli tool, I get 0x99 error. What is 0x99 error?",https://stackoverflow.com/questions/76507004/when-i-tried-to-mint-nfts-using-cmv3-from-metaplex-in-solana-using-the-ui-and,1,0,84,2023/6/19 21:15,"solana, metaplex, candy-machine",Corrective
76781215,Error: Invalid option &#39;tokenMint&#39; after connecting phantom wallet to Candy Machine UI,https://stackoverflow.com/questions/76781215/error-invalid-option-tokenmint-after-connecting-phantom-wallet-to-candy-machi,0,1,84,2023/7/27 23:17,"solana, solana-web3js, metaplex, candy-machine",Corrective
76565036,Smart contract panicked: cannot read property &#39;prefix&#39; of undefined\n,https://stackoverflow.com/questions/76565036/smart-contract-panicked-cannot-read-property-prefix-of-undefined-n,2,1,84,2023/6/27 20:49,"typescript, smartcontracts, nearprotocol",Corrective
76077072,Got error &quot;Cross-program invocation with unauthorized signer or writable account&quot;,https://stackoverflow.com/questions/76077072/got-error-cross-program-invocation-with-unauthorized-signer-or-writable-account,0,0,80,2023/4/22 6:22,"solana, solana-web3js, solana-program-library, solana-transaction-instruction",Corrective
72739009,C++ error: (eosio contract): Decomposes into 2 elements but only 1 names were provided,https://stackoverflow.com/questions/72739009/c-error-eosio-contract-decomposes-into-2-elements-but-only-1-names-were-pr,0,1,79,2022/6/24 12:25,"c++, blockchain, smartcontracts, cryptocurrency, eos",Corrective
76524496,Rust WASM memory.buffer TypeError: Cannot read properties of undefined (reading &#39;buffer&#39;),https://stackoverflow.com/questions/76524496/rust-wasm-memory-buffer-typeerror-cannot-read-properties-of-undefined-reading,0,0,79,2023/6/21 22:37,"rust, webassembly, wasm-bindgen, rust-wasm",Corrective
76886923,"avm install 0.28.0 gives &quot;cannot compile `libsecp256k1` (lib) error&quot; on AWS EC2 Ubuntu and Digital Ocean Ubuntu droplet, no issues locally",https://stackoverflow.com/questions/76886923/avm-install-0-28-0-gives-cannot-compile-libsecp256k1-lib-error-on-aws-ec2,0,1,78,2023/8/12 6:15,"amazon-web-services, digital-ocean, solana, anchor-solana",Corrective
76119321,I had a signature verification error with migration from Helium to Solana,https://stackoverflow.com/questions/76119321/i-had-a-signature-verification-error-with-migration-from-helium-to-solana,0,0,74,2023/4/27 18:24,"blockchain, web3js, solana-web3js, anchor-solana, helium-api",Corrective
70750071,Error: Bad parameter: OUR_VALIDATOR_PUBKEY (and possibly OUR_URL) must be specified unless --our-localhost is given,https://stackoverflow.com/questions/70750071/error-bad-parameter-our-validator-pubkey-and-possibly-our-url-must-be-specif,0,1,74,2022/1/18 11:47,solana,Corrective
75511270,ReferenceError: Event is not defined for @wallet-standard/wallet,https://stackoverflow.com/questions/75511270/referenceerror-event-is-not-defined-for-wallet-standard-wallet,0,0,74,2023/2/20 23:35,"typescript, web3js, solana, solana-web3js",Corrective
70867157,correct format of SaleArgs parameter for nft_approve msg,https://stackoverflow.com/questions/70867157/correct-format-of-saleargs-parameter-for-nft-approve-msg,1,1,69,2022/1/27 0:46,nearprotocol,Corrective
74908434,how can I handle solana api get_transaction method error?,https://stackoverflow.com/questions/74908434/how-can-i-handle-solana-api-get-transaction-method-error,0,0,61,2022/12/24 23:02,"json, api, solana",Corrective
76379018,Error during parse the genesis file of the cosmos blockchain,https://stackoverflow.com/questions/76379018/error-during-parse-the-genesis-file-of-the-cosmos-blockchain,0,0,60,2023/6/1 13:53,"configuration, blockchain, cosmos",Corrective
75985214,Why does a &quot;bad format&quot; error occur when importing a key into phantom app?,https://stackoverflow.com/questions/75985214/why-does-a-bad-format-error-occur-when-importing-a-key-into-phantom-app,2,1,60,2023/4/11 19:11,"python, solana",Corrective
75856565,TypeError: &#39;solders.rpc.responses.GetAccountInfoResp&#39; object is not subscriptable (Solana program),https://stackoverflow.com/questions/75856565/typeerror-solders-rpc-responses-getaccountinforesp-object-is-not-subscriptabl,2,1,60,2023/3/27 21:48,"solana, json-rpc",Corrective
76651040,&quot;cargo check -p node-template-runtime --release&quot; error: failed to select a version for `signature`,https://stackoverflow.com/questions/76651040/cargo-check-p-node-template-runtime-release-error-failed-to-select-a-versi,0,1,60,2023/7/10 14:08,"substrate, polkadot",Corrective
73806543,How to parse a transaction correctly | NEAR data lake indexer,https://stackoverflow.com/questions/73806543/how-to-parse-a-transaction-correctly-near-data-lake-indexer,1,1,59,2022/9/22 4:23,nearprotocol,Corrective
75502972,why am I getting an invalid token standard error?,https://stackoverflow.com/questions/75502972/why-am-i-getting-an-invalid-token-standard-error,0,0,58,2023/2/20 3:43,"javascript, smartcontracts, solana, solana-web3js, metaplex",Corrective
75916709,Substrate Error: Protoc can&#39;t be accessed when running cargo build --release and --locked and is necesaary to compile node completely,https://stackoverflow.com/questions/75916709/substrate-error-protoc-cant-be-accessed-when-running-cargo-build-release-and,0,0,57,2023/4/3 14:51,"substrate, polkadot, pallet",Corrective
76530900,Magic Eden API issue instruction &#39;buy&#39;,https://stackoverflow.com/questions/76530900/magic-eden-api-issue-instruction-buy,1,0,55,2023/6/22 18:21,"python-3.x, solana",Corrective
73582808,Error when try to run the command &quot;npm run start-solana-main&quot; to run on solana CLI,https://stackoverflow.com/questions/73582808/error-when-try-to-run-the-command-npm-run-start-solana-main-to-run-on-solana-c,1,1,53,2022/9/2 20:47,"anchor, solana, anchor-solana, solana-transaction-instruction",Corrective
70795225,Error when accessing Persistant vector of object instances,https://stackoverflow.com/questions/70795225/error-when-accessing-persistant-vector-of-object-instances,0,1,52,2022/1/21 9:06,nearprotocol,Corrective
76456260,Property &#39;wallets&#39; does not exist on type &#39;IntrinsicAttributes &amp; WalletModalProviderProps&#39;. How can i fix it?,https://stackoverflow.com/questions/76456260/property-wallets-does-not-exist-on-type-intrinsicattributes-walletmodalprov,0,1,50,2023/6/12 19:34,"reactjs, solana, tsx, wallet",Corrective
76795396,Getting an invalid type error during contract instantiation on the Archway network,https://stackoverflow.com/questions/76795396/getting-an-invalid-type-error-during-contract-instantiation-on-the-archway-netwo,2,1,44,2023/7/30 4:41,"archway-network, cosmwasm",Corrective
75804250,I keep getting spawn npm ENOENT error when trying to run boa locally and I don&#39;t know how to resolve it,https://stackoverflow.com/questions/75804250/i-keep-getting-spawn-npm-enoent-error-when-trying-to-run-boa-locally-and-i-dont,0,0,43,2023/3/22 1:02,"node.js, spawn, enoent, wasm-pack",Corrective
76347195,rust wasm-pack build warning: private type `World` in public interface (error E0446),https://stackoverflow.com/questions/76347195/rust-wasm-pack-build-warning-private-type-world-in-public-interface-error-e0,0,1,42,2023/5/27 21:36,"rust, wasm-bindgen, wasm-pack",Corrective
76812060,Running a cosmwasm smart query - out of gas error,https://stackoverflow.com/questions/76812060/running-a-cosmwasm-smart-query-out-of-gas-error,2,1,41,2023/8/1 21:19,"archway-network, cosmwasm",Corrective
77322720,Linking error - error: linking with `cc` failed: exit code: 1,https://stackoverflow.com/questions/77322720/linking-error-error-linking-with-cc-failed-exit-code-1,-1,0,40,2023/10/19 17:51,"rust, blockchain, rust-cargo, solana, solana-web3js",Corrective
74230795,I am trying to build a facebook clone dapp using solana and next js. I followed the tutorial but i still run into this error,https://stackoverflow.com/questions/74230795/i-am-trying-to-build-a-facebook-clone-dapp-using-solana-and-next-js-i-followed,-2,1,39,2022/10/28 12:52,"next.js, solana, decentralized-applications",Corrective
71156357,Simulation test of public method taking integers arguments fails with errorcode &quot;WasmUnknownError&quot;,https://stackoverflow.com/questions/71156357/simulation-test-of-public-method-taking-integers-arguments-fails-with-errorcode,-1,1,38,2022/2/17 18:27,"nearprotocol, assemblyscript",Corrective
