id_discussion,title,link,score,answer_count,view_count,creation_date,tags,Category
70240586,I keep getting an &quot;error: constexpr variable &#39;x&#39; must be initialized by a constant expression&quot; from previously used working code,https://stackoverflow.com/questions/70240586/i-keep-getting-an-error-constexpr-variable-x-must-be-initialized-by-a-consta,0,1,412,2021/12/6 11:34,"c++, eos",Corrective
69158817,How to set the default value for StorageValue?,https://stackoverflow.com/questions/69158817/how-to-set-the-default-value-for-storagevalue,1,1,411,2021/9/13 15:28,"substrate, polkadot",Corrective
73623286,Getting error: No identifiers allowed directly after numeric literal,https://stackoverflow.com/questions/73623286/getting-error-no-identifiers-allowed-directly-after-numeric-literal,0,0,407,2022/9/6 21:56,"reactjs, typescript, react-native, solana-web3js, solana-program-library",Corrective
71274544,Getting error: failed to download `solana-frozen-abi v1.9.9` while running anchor test on macbook m1,https://stackoverflow.com/questions/71274544/getting-error-failed-to-download-solana-frozen-abi-v1-9-9-while-running-ancho,2,1,401,2022/2/26 14:24,"rust-cargo, solana, solana-web3js, anchor-solana, solana-cli",Corrective
51918722,EOSIO Tutorial cleos create account Error 3080004,https://stackoverflow.com/questions/51918722/eosio-tutorial-cleos-create-account-error-3080004,1,1,398,2018/8/19 22:37,eos,Corrective
70033520,NEAR smart-contract error: &quot;Contract is not initialized&quot;,https://stackoverflow.com/questions/70033520/near-smart-contract-error-contract-is-not-initialized,1,2,398,2021/11/19 18:41,"nearprotocol, assemblyscript",Corrective
72121414,WalletNotReadyError- I got it when I develop Solana wallet integration with React.js in chrome extension,https://stackoverflow.com/questions/72121414/walletnotreadyerror-i-got-it-when-i-develop-solana-wallet-integration-with-reac,1,0,393,2022/5/5 10:57,"reactjs, google-chrome-extension, solana-web3js, wallet-connect",Corrective
73324192,Transaction with &quot;SystemProgram.createAccount&quot; results in &quot;Error: Signature verification failed at Transaction.serialize&quot;,https://stackoverflow.com/questions/73324192/transaction-with-systemprogram-createaccount-results-in-error-signature-veri,1,1,390,2022/8/12 0:38,"solana, solana-web3js, solana-transaction-instruction",Corrective
75309697,Solana web3 js failed to get recent blockhash error 403,https://stackoverflow.com/questions/75309697/solana-web3-js-failed-to-get-recent-blockhash-error-403,1,1,374,2023/2/1 19:45,"web3js, solana",Corrective
72113499,Issue with getOrCreateAssociatedAccountInfo on Quicknode,https://stackoverflow.com/questions/72113499/issue-with-getorcreateassociatedaccountinfo-on-quicknode,0,1,371,2022/5/4 21:07,"solana-web3js, solana-program-library",Corrective
72911002,An Reference Error is occured at &quot;@polkadot/extension-dapp/bundle.js&quot;,https://stackoverflow.com/questions/72911002/an-reference-error-is-occured-at-polkadot-extension-dapp-bundle-js,2,1,370,2022/7/8 19:54,"next.js, polkadot-js",Corrective
74870289,&quot;ERR_BLOCKED_BY_RESPONSE.NotSameOriginAfterDefaultedToSameOriginByCoep&quot; when using FFmpeg wasm and setupProxy.js - Reactjs,https://stackoverflow.com/questions/74870289/err-blocked-by-response-notsameoriginafterdefaultedtosameoriginbycoep-when-usi,1,1,365,2022/12/21 8:40,"javascript, reactjs, cors, cross-origin-opener-policy, ffmpeg-wasm",Corrective
68513982,How to exec js code on rust with wasm-bindgen correctly,https://stackoverflow.com/questions/68513982/how-to-exec-js-code-on-rust-with-wasm-bindgen-correctly,4,0,365,2021/7/25 5:36,"rust, webassembly, wasm-bindgen, rust-wasm, yew",Corrective
71248394,solana logs failing with: Error: unable to connect to server yet solana-test-validator is running,https://stackoverflow.com/questions/71248394/solana-logs-failing-with-error-unable-to-connect-to-server-yet-solana-test-val,-1,1,365,2022/2/24 15:19,"solana, solana-cli",Corrective
76213582,error[E0277]: the trait bound `MovieAccountState: borsh::de::BorshDeserialize` is not satisfied,https://stackoverflow.com/questions/76213582/errore0277-the-trait-bound-movieaccountstate-borshdeborshdeserialize-i,0,2,363,2023/5/10 5:49,"rust, solana",Corrective
76452749,leptos with axum: Issue with wasm-bindgen versions,https://stackoverflow.com/questions/76452749/leptos-with-axum-issue-with-wasm-bindgen-versions,1,1,361,2023/6/12 6:25,"rust, wasm-bindgen, rust-axum, leptos",Corrective
72515870,I am getting &quot;custom program error: 0x3b&quot; on updating the metadata of a NFT using the token metadata program?,https://stackoverflow.com/questions/72515870/i-am-getting-custom-program-error-0x3b-on-updating-the-metadata-of-a-nft-usin,0,2,360,2022/6/6 17:49,"solana, metaplex",Corrective
72845892,"Could not complete Bundlr tx upload successfully, exiting due to: Error: connect ETIMEDOUT 172.3 at TCPConnectWrap.afterConnect [as oncomplete]",https://stackoverflow.com/questions/72845892/could-not-complete-bundlr-tx-upload-successfully-exiting-due-to-error-connect,-2,1,360,2022/7/3 18:55,"solana, nft, metaplex, candy-machine, solana-cli",Corrective
72959078,Polkadot.js &quot;signAndSend&quot; function causes &quot;signer&quot; option to compile error,https://stackoverflow.com/questions/72959078/polkadot-js-signandsend-function-causes-signer-option-to-compile-error,0,1,353,2022/7/13 6:38,"next.js, polkadot-js",Corrective
71815480,Metaplex Candy Machine metadata not displaying correctly on Solscan,https://stackoverflow.com/questions/71815480/metaplex-candy-machine-metadata-not-displaying-correctly-on-solscan,0,1,352,2022/4/10 17:54,"solana, metaplex, candy-machine",Corrective
76371275,How to fix &#39;failed to select a version&#39; error when running &#39;cargo build-bpf&#39; in Solana rust program?,https://stackoverflow.com/questions/76371275/how-to-fix-failed-to-select-a-version-error-when-running-cargo-build-bpf-in,1,1,351,2023/5/31 15:50,"rust-cargo, solana",Corrective
73232220,AnchorError: Error Number: 101. Error Message: Fallback functions are not supported,https://stackoverflow.com/questions/73232220/anchorerror-error-number-101-error-message-fallback-functions-are-not-suppor,1,0,348,2022/8/4 15:50,"reactjs, solana-web3js, anchor-solana",Corrective
68436677,Got this runtime error while implementing assets pallet in substrate(1002: Verification Error: Runtime error: Execution failed:,https://stackoverflow.com/questions/68436677/got-this-runtime-error-while-implementing-assets-pallet-in-substrate1002-verif,0,0,345,2021/7/19 15:30,"blockchain, substrate, polkadot, polkadot-js",Corrective
75646159,How to resolve E0658 error code on Anchor?,https://stackoverflow.com/questions/75646159/how-to-resolve-e0658-error-code-on-anchor,0,2,343,2023/3/6 8:12,"rust, anchor, solana, anchor-solana",Corrective
74140697,Solana anchor Error processing Instruction 0: Cross-program invocation with unauthorized signer or writable account,https://stackoverflow.com/questions/74140697/solana-anchor-error-processing-instruction-0-cross-program-invocation-with-unau,0,2,340,2022/10/20 21:27,"solana, anchor-solana",Corrective
70594401,Why am I seeing error: Cannot find name &#39;decode&#39; and &#39;encode&#39; when building a NEAR smart contract (AssemblyScript)?,https://stackoverflow.com/questions/70594401/why-am-i-seeing-error-cannot-find-name-decode-and-encode-when-building-a-ne,2,1,339,2022/1/5 22:16,nearprotocol,Corrective
73183281,"`Err` value: TransactionError(InstructionError(0, ProgramFailedToComplete))&#39;",https://stackoverflow.com/questions/73183281/err-value-transactionerrorinstructionerror0-programfailedtocomplete,1,1,332,2022/7/31 20:24,"solana, solana-transaction-instruction",Corrective
72265585,Solana metaplex-program-library thread &#39;main&#39; panicked at &#39;Code not parseable: Error(&quot;space must be provided with init&quot;)&#39;,https://stackoverflow.com/questions/72265585/solana-metaplex-program-library-thread-main-panicked-at-code-not-parseable-e,0,1,330,2022/5/17 5:01,"solana, metaplex, anchor-solana",Corrective
72791740,Error when calling web3.sendRawTransaction(signature.serialize()),https://stackoverflow.com/questions/72791740/error-when-calling-web3-sendrawtransactionsignature-serialize,0,1,330,2022/6/29 2:48,"web3js, solana, nft, solana-web3js, phantom-wallet",Corrective
70887847,Basic Error Deploy Terrain dApp on LocalTerra,https://stackoverflow.com/questions/70887847/basic-error-deploy-terrain-dapp-on-localterra,1,1,326,2022/1/28 9:28,"docker, rust, webassembly, rust-crates, rust-wasm",Corrective
75273199,Solana Anchor Lang: anchor init creates project with TypeError: Cannot read properties of undefined (reading &#39;methods&#39;),https://stackoverflow.com/questions/75273199/solana-anchor-lang-anchor-init-creates-project-with-typeerror-cannot-read-prop,0,1,324,2023/1/29 15:17,"blockchain, smartcontracts, solana, anchor-solana",Corrective
69604206,Issue with Solana wallet by sending funds to Associated Token Metadata account,https://stackoverflow.com/questions/69604206/issue-with-solana-wallet-by-sending-funds-to-associated-token-metadata-account,0,1,322,2021/10/17 20:10,"cryptocurrency, solana, wallet-connect",Corrective
70400723,gcc error when installing wasm-pack for Rust,https://stackoverflow.com/questions/70400723/gcc-error-when-installing-wasm-pack-for-rust,1,0,321,2021/12/18 11:09,"rust, webassembly, wasm-pack",Corrective
69881374,pyserum place order unknow instruction error,https://stackoverflow.com/questions/69881374/pyserum-place-order-unknow-instruction-error,0,1,318,2021/11/8 17:39,"python, solana",Corrective
68687367,Purge parachain issue,https://stackoverflow.com/questions/68687367/purge-parachain-issue,2,1,317,2021/8/7 4:54,"blockchain, substrate, polkadot",Corrective
69178033,Moonbeam (polkadot parachain) transaction error,https://stackoverflow.com/questions/69178033/moonbeam-polkadot-parachain-transaction-error,2,0,312,2021/9/14 20:44,"docker, docker-compose, blockchain, polkadot",Corrective
59405768,How to solve &#39;missing setcode.vmtype (type=uint8)&#39; error when deploying EOS Smart Contract using eosjs?,https://stackoverflow.com/questions/59405768/how-to-solve-missing-setcode-vmtype-type-uint8-error-when-deploying-eos-smar,2,1,308,2019/12/19 16:22,"node.js, eos",Corrective
76255198,Getting error while running program in node js related to solana web3,https://stackoverflow.com/questions/76255198/getting-error-while-running-program-in-node-js-related-to-solana-web3,1,1,307,2023/5/15 22:39,"node.js, solana, metaplex, anchor-solana",Corrective
73504288,"Solana: Error processing Instruction 0: Cross-program invocation with unauthorized signer or writable account, Transfer sol to wallet without pri key",https://stackoverflow.com/questions/73504288/solana-error-processing-instruction-0-cross-program-invocation-with-unauthoriz,0,0,307,2022/8/27 0:55,"solana, solana-web3js, anchor-solana, solana-program-library, solana-transaction-instruction",Corrective
72299836,is there a way to fix metaplex uploading issue?,https://stackoverflow.com/questions/72299836/is-there-a-way-to-fix-metaplex-uploading-issue,0,1,306,2022/5/19 14:48,"command-line-interface, solana, nft, solana-web3js, metaplex",Corrective
64099133,Why does i got lifetime error in rust closure,https://stackoverflow.com/questions/64099133/why-does-i-got-lifetime-error-in-rust-closure,0,1,306,2020/9/28 17:07,"rust, rust-wasm",Corrective
75466315,Error: failed to send transaction: Transaction simulation failed: Error processing Instruction 1: An account required by the instruction is missing,https://stackoverflow.com/questions/75466315/error-failed-to-send-transaction-transaction-simulation-failed-error-processi,0,0,305,2023/2/16 7:18,"rust, solana",Corrective
73826606,ah_auctioneer_pda. Error Code: ConstraintSeeds. Error Number: 2006. Error A seeds constraint was violated. even the though the pda address is correct,https://stackoverflow.com/questions/73826606/ah-auctioneer-pda-error-code-constraintseeds-error-number-2006-error-a-seed,0,1,301,2022/9/23 18:48,"solana, metaplex",Corrective
68760478,What does &quot;Invoke context not set error&quot; occur when I am testing?,https://stackoverflow.com/questions/68760478/what-does-invoke-context-not-set-error-occur-when-i-am-testing,0,1,299,2021/8/12 23:42,"rust, rust-cargo, solana",Corrective
72061609,`Invalid blockhash` error while deploying smart contract,https://stackoverflow.com/questions/72061609/invalid-blockhash-error-while-deploying-smart-contract,3,1,297,2022/4/30 1:21,"solana, chainlink",Corrective
59665609,Using stof or strtof (string to float) in C++ compiled to Webassembly gives me a runtime error,https://stackoverflow.com/questions/59665609/using-stof-or-strtof-string-to-float-in-c-compiled-to-webassembly-gives-me-a,0,0,292,2020/1/9 21:58,"c++, webassembly, smartcontracts, eos",Corrective
70978349,"NEAR FunctionCallError(HostError(GuestPanic { panic_msg: &quot;panicked at &#39;Failed to deserialize input from JSON.: Error(\&quot;the account ID is invalid\&quot;,",https://stackoverflow.com/questions/70978349/near-functioncallerrorhosterrorguestpanic-panic-msg-panicked-at-failed-to,1,1,292,2022/2/4 5:10,nearprotocol,Corrective
72282977,differences between the wo kinds of Cosmos sequence errors,https://stackoverflow.com/questions/72282977/differences-between-the-wo-kinds-of-cosmos-sequence-errors,2,1,288,2022/5/18 11:46,"blockchain, cosmos",Corrective
72626538,TypeError: _bundlr_network_client__WEBPACK_IMPORTED_MODULE_0__ is not a constructor while using metaplex.nfts().uploadMetadata(),https://stackoverflow.com/questions/72626538/typeerror-bundlr-network-client-webpack-imported-module-0-is-not-a-construc,1,1,281,2022/6/15 14:02,"blockchain, solana, metaplex",Corrective
76084583,Candy Machine mintV2 - Error: failed to send transaction: Transaction simulation failed,https://stackoverflow.com/questions/76084583/candy-machine-mintv2-error-failed-to-send-transaction-transaction-simulation,0,1,279,2023/4/23 19:33,"solana, metaplex, candy-machine",Corrective
70702840,Can view methods be used for cross contract calls? (Getting error HostError(ProhibitedInView { method_name: &quot;promise_batch_create&quot;}),https://stackoverflow.com/questions/70702840/can-view-methods-be-used-for-cross-contract-calls-getting-error-hosterrorproh,2,1,276,2022/1/14 4:39,nearprotocol,Corrective
72433794,Metaplex Auction house execute_sale function is throwing error &quot; Program log: panicked at &#39;index out of bounds: the len is 0 but the index is 0&#39;&quot;,https://stackoverflow.com/questions/72433794/metaplex-auction-house-execute-sale-function-is-throwing-error-program-log-pa,2,1,275,2022/5/30 19:44,"solana, metaplex",Corrective
71188617,Getting error while trying to buy NFT on mainnet? Solana Metaplex/Storefront,https://stackoverflow.com/questions/71188617/getting-error-while-trying-to-buy-nft-on-mainnet-solana-metaplex-storefront,1,0,275,2022/2/20 3:49,"solana, storefront, metaplex",Corrective
70767805,error: building the downstream libh3 C library using the Solana SDK via cmake,https://stackoverflow.com/questions/70767805/error-building-the-downstream-libh3-c-library-using-the-solana-sdk-via-cmake,2,1,270,2022/1/19 17:01,"rust, cmake, solana",Corrective
72942699,"error is imported here, but it is a function-like macro",https://stackoverflow.com/questions/72942699/error-is-imported-here-but-it-is-a-function-like-macro,0,1,269,2022/7/12 1:50,"blockchain, smartcontracts, solana, anchor-solana",Corrective
75064290,&quot;Error: failed to post funding tx&quot; on metaplex,https://stackoverflow.com/questions/75064290/error-failed-to-post-funding-tx-on-metaplex,3,2,267,2023/1/10 8:29,"node.js, reactjs, solana, nft, metaplex",Corrective
72349514,Error installing anchor-cli | solana | rpc port: {rpc_port} is already in use,https://stackoverflow.com/questions/72349514/error-installing-anchor-cli-solana-rpc-port-rpc-port-is-already-in-use,1,1,263,2022/5/23 21:35,"solana, anchor-solana",Corrective
72370984,"On mainnet-beta, signMetadata() returns a program error, whereas it works on devnet",https://stackoverflow.com/questions/72370984/on-mainnet-beta-signmetadata-returns-a-program-error-whereas-it-works-on-dev,0,1,263,2022/5/25 9:07,"web3js, solana, nft, solana-web3js, metaplex",Corrective
70457160,"Falling into issues Trying to Create a Program Derived Address (PDA) with Solana-py: &quot;not enough values to unpack (expected 2, got 1)&quot;",https://stackoverflow.com/questions/70457160/falling-into-issues-trying-to-create-a-program-derived-address-pda-with-solana,0,1,262,2021/12/23 10:44,"python, solana",Corrective
73640824,"Error: Cannot find module code: &#39;MODULE_NOT_FOUND&#39;, (metaplex)",https://stackoverflow.com/questions/73640824/error-cannot-find-module-code-module-not-found-metaplex,-1,1,260,2022/9/8 3:51,"solana, metaplex",Corrective
74662830,How do I remove this compiler error for use_store with yewdux?,https://stackoverflow.com/questions/74662830/how-do-i-remove-this-compiler-error-for-use-store-with-yewdux,2,1,259,2022/12/3 8:09,"rust, webassembly, rust-wasm, yew",Corrective
72253067,Weird Typescript Bug: Imports dependency not top level module,https://stackoverflow.com/questions/72253067/weird-typescript-bug-imports-dependency-not-top-level-module,3,3,258,2022/5/16 8:17,"typescript, solana, solana-web3js, solana-program-library",Corrective
64070229,Cant run wasm module on cmd. Error: failed to run main module `demo.wasm`,https://stackoverflow.com/questions/64070229/cant-run-wasm-module-on-cmd-error-failed-to-run-main-module-demo-wasm,-1,2,256,2020/9/26 3:23,"cmd, wasmtime",Corrective
70925968,Tightly Coupling pallet error: ambiguous associated type `Currency` in bounds of `T`,https://stackoverflow.com/questions/70925968/tightly-coupling-pallet-error-ambiguous-associated-type-currency-in-bounds-of,2,1,256,2022/1/31 20:27,"substrate, polkadot",Corrective
75611088,Rust not using correct version,https://stackoverflow.com/questions/75611088/rust-not-using-correct-version,0,1,254,2023/3/2 11:29,"rust, anchor, solana",Corrective
71483723,NEAR Protocol Smart Contract Instantiation Error,https://stackoverflow.com/questions/71483723/near-protocol-smart-contract-instantiation-error,4,1,252,2022/3/15 22:11,"nearprotocol, near",Corrective
73090565,having issues with deploying smart contract on solana,https://stackoverflow.com/questions/73090565/having-issues-with-deploying-smart-contract-on-solana,0,0,252,2022/7/23 20:00,"solana, solana-web3js, anchor-solana, solana-cli, solana-program-library",Corrective
51348983,EOSIO - cleos wallet create command throwing error &quot;Invalid content-length response&quot;,https://stackoverflow.com/questions/51348983/eosio-cleos-wallet-create-command-throwing-error-invalid-content-length-respo,0,1,251,2018/7/15 21:44,eos,Corrective
73526248,Transaction fee payer required error when listing a token on Auction House,https://stackoverflow.com/questions/73526248/transaction-fee-payer-required-error-when-listing-a-token-on-auction-house,0,1,251,2022/8/29 16:47,"solana, metaplex",Corrective
72344967,RPC response error -32003: error when updating solana nft using metaboss,https://stackoverflow.com/questions/72344967/rpc-response-error-32003-error-when-updating-solana-nft-using-metaboss,1,1,244,2022/5/23 15:49,solana,Corrective
70915556,NotImplementedError in publickey.PublicKey().find_program_address() solana-py,https://stackoverflow.com/questions/70915556/notimplementederror-in-publickey-publickey-find-program-address-solana-py,1,2,242,2022/1/30 22:23,"solana, solana-web3js, solana-program-library",Corrective
72313952,What the error EditionsMustHaveExactlyOneToken really mean?,https://stackoverflow.com/questions/72313952/what-the-error-editionsmusthaveexactlyonetoken-really-mean,-1,1,240,2022/5/20 13:29,"solana, solana-web3js, metaplex",Corrective
65435128,Error about connecting Substrate blockchains to Polkadot with Cumulus,https://stackoverflow.com/questions/65435128/error-about-connecting-substrate-blockchains-to-polkadot-with-cumulus,1,1,234,2020/12/24 15:10,"blockchain, substrate, polkadot",Corrective
75607903,Error installing Rust wasm-pack for webassembly,https://stackoverflow.com/questions/75607903/error-installing-rust-wasm-pack-for-webassembly,0,0,233,2023/3/2 3:02,"rust, webassembly, rust-cargo, wasm-pack",Corrective
74779178,How to handle cors error using Magic Eden API?,https://stackoverflow.com/questions/74779178/how-to-handle-cors-error-using-magic-eden-api,0,0,229,2022/12/13 9:54,"reactjs, api, solana, nft",Corrective
74602940,Init Token Account error - &quot;Error processing Instruction 0: custom program error: 0x0&quot;,https://stackoverflow.com/questions/74602940/init-token-account-error-error-processing-instruction-0-custom-program-error,-1,1,228,2022/11/28 23:32,"rust, solana, anchor-solana, solana-program-library",Corrective
74061767,How can we install the Solana CLI when we get the below error?,https://stackoverflow.com/questions/74061767/how-can-we-install-the-solana-cli-when-we-get-the-below-error,1,2,227,2022/10/14 5:02,solana,Corrective
71661190,Near Protocol | RPC Contract deployment | Deserialization error,https://stackoverflow.com/questions/71661190/near-protocol-rpc-contract-deployment-deserialization-error,0,1,224,2022/3/29 19:27,"deserialization, smartcontracts, nearprotocol, near, assemblyscript",Corrective
72268271,Solana error on metaplex when trying to make auction,https://stackoverflow.com/questions/72268271/solana-error-on-metaplex-when-trying-to-make-auction,0,0,223,2022/5/17 12:35,"rust, solana, metaplex",Corrective
69656955,Error while adding Nick Pallet to substrate,https://stackoverflow.com/questions/69656955/error-while-adding-nick-pallet-to-substrate,1,0,223,2021/10/21 14:32,"substrate, polkadot",Corrective
74485335,TypeError: x.pubkey.toBase58 is not a function,https://stackoverflow.com/questions/74485335/typeerror-x-pubkey-tobase58-is-not-a-function,0,1,219,2022/11/18 13:36,"javascript, solana, solana-web3js",Corrective
73150321,Cannot deploy EVM subnet locally on Avalanche &quot;Error: failed to query network health&quot;,https://stackoverflow.com/questions/73150321/cannot-deploy-evm-subnet-locally-on-avalanche-error-failed-to-query-network-he,1,1,219,2022/7/28 17:20,"linux, terminal, virtual-machine, evm, avalanche",Corrective
69633580,Near Protocol: Error during Context.predecessor in view,https://stackoverflow.com/questions/69633580/near-protocol-error-during-context-predecessor-in-view,2,1,218,2021/10/19 23:21,nearprotocol,Corrective
76202581,How to get Solana Nfts for owner with Metaplex in React? (Error: 410),https://stackoverflow.com/questions/76202581/how-to-get-solana-nfts-for-owner-with-metaplex-in-react-error-410,0,2,216,2023/5/9 0:42,"reactjs, react-hooks, solana, metaplex, alchemy",Corrective
72381059,web3.Keypair.fromSeed issues,https://stackoverflow.com/questions/72381059/web3-keypair-fromseed-issues,0,1,215,2022/5/26 0:11,solana-web3js,Corrective
72435369,MetaplexError: Invalid owner,https://stackoverflow.com/questions/72435369/metaplexerror-invalid-owner,0,1,213,2022/5/30 21:45,"javascript, solana, solana-web3js, metaplex",Corrective
72861128,Error when compiling &quot;example-helloworld&quot; Solana Smart Contract,https://stackoverflow.com/questions/72861128/error-when-compiling-example-helloworld-solana-smart-contract,0,1,213,2022/7/5 3:12,"rust, rust-cargo, solana",Corrective
70766123,How to create pallet errors that show up on the Polkadot JS apps interface?,https://stackoverflow.com/questions/70766123/how-to-create-pallet-errors-that-show-up-on-the-polkadot-js-apps-interface,2,1,206,2022/1/19 14:26,"substrate, polkadot-js",Corrective
73020348,Error processing Instruction 0: Cross-program invocation with unauthorized signer or writable account,https://stackoverflow.com/questions/73020348/error-processing-instruction-0-cross-program-invocation-with-unauthorized-signe,-1,1,204,2022/7/18 17:51,"rust, anchor, smartcontracts, solana",Corrective
73017542,Error: Querying [object Object] failed: wasm execution failed with error,https://stackoverflow.com/questions/73017542/error-querying-object-object-failed-wasm-execution-failed-with-error,0,1,197,2022/7/18 13:07,"rust, nearprotocol",Corrective
67953918,How can I solve the error of Smart Contract?,https://stackoverflow.com/questions/67953918/how-can-i-solve-the-error-of-smart-contract,2,1,192,2021/6/13 8:25,"smartcontracts, nearprotocol",Corrective
72689378,mint_to from token.sol example from solang throw new Error(unknown signer: ${signature.publicKey.toString()});,https://stackoverflow.com/questions/72689378/mint-to-from-token-sol-example-from-solang-throw-new-errorunknown-signer-sig,0,1,192,2022/6/20 23:20,"solana, solana-web3js",Corrective
74448290,SendTransactionError: failed to send transaction: Node is unhealthy,https://stackoverflow.com/questions/74448290/sendtransactionerror-failed-to-send-transaction-node-is-unhealthy,1,1,189,2022/11/15 23:33,"solana, solana-web3js, solana-cli, solana-program-library",Corrective
73602758,"Cannot deserialize the contract state.: Custom { kind: InvalidData, error: &quot;Not all bytes read&quot;",https://stackoverflow.com/questions/73602758/cannot-deserialize-the-contract-state-custom-kind-invaliddata-error-not,1,1,185,2022/9/5 4:52,nearprotocol,Corrective
73187286,My transaction fails when trying to Init VRF on Devnet using Anchor (0x0 Error),https://stackoverflow.com/questions/73187286/my-transaction-fails-when-trying-to-init-vrf-on-devnet-using-anchor-0x0-error,2,1,183,2022/8/1 6:15,"rust, anchor, solana",Corrective
74081105,Error compiling dependency to a proc-macro when targeting wasm,https://stackoverflow.com/questions/74081105/error-compiling-dependency-to-a-proc-macro-when-targeting-wasm,1,0,179,2022/10/16 0:16,"rust, conditional-compilation, wasm-bindgen, rust-wasm",Corrective
